{
  "policy_pack_id": "official-alert-policy-v1",
  "version": "1.0.0",
  "domain": "weather",
  "rules": [
    {
      "rule_id": "OFFICIAL_ALERT_SUPREMACY",
      "deontic": "MUST",
      "condition": "active_official_alert_count > 0",
      "effect": "PROTOCOL",
      "product_verdict": "official_alert_governs",
      "reason_code": "official_alert_supremacy",
      "artifact_required": true
    }
  ]
}
