{
  "policy_pack_id": "artifact-policy-v1",
  "version": "1.0.0",
  "domain": "weather",
  "rules": [
    {
      "rule_id": "EVERY_VERDICT_REQUIRES_ARTIFACT",
      "deontic": "MUST",
      "condition": "artifact_created == true",
      "effect_if_failed": "BLOCK",
      "reason_code": "missing_artifact",
      "artifact_required": true
    }
  ]
}
