{
  "policy_pack_id": "replay-policy-v1",
  "version": "1.0.0",
  "domain": "weather",
  "rules": [
    {
      "rule_id": "VERDICT_MUST_BE_REPLAYABLE",
      "deontic": "MUST",
      "condition": "verdict_replayable == true",
      "effect_if_failed": "BLOCK",
      "reason_code": "verdict_not_replayable",
      "artifact_required": true
    }
  ]
}
